{
  "id": "evt_01J9FIXTURE0101",
  "type": "bid.placed",
  "version": 1,
  "source": "institution",
  "occurred_at": "2026-10-01T09:14:03Z",
  "aggregate_id": "00000000-0000-4000-8000-000000000010",
  "sequence": 1,
  "data": {
    "bid_id": "00000000-0000-4000-8000-000000000010",
    "request_id": "00000000-0000-4000-8000-000000000001",
    "institution_id": "00000000-0000-4000-8000-000000000020",
    "institution_name": "MCB",
    "institution_logo_url": null,
    "status": "submitted",
    "rate": 0.0425,
    "rate_type": "fixed",
    "rate_valid_days": 30,
    "amount_offered": 3000000,
    "currency": "MUR",
    "term_months": 240,
    "conditions": {},
    "fee_structure": {},
    "benefits": [
      {
        "title": "0.25% rate discount",
        "value_display": "0.25% off the rate",
        "is_guaranteed": true,
        "cat_code": "rate_discount",
        "value_amount": 0.0025,
        "value_unit": "rate_pa"
      },
      {
        "title": "Processing fee waived",
        "value_display": "100% of the processing fee",
        "is_guaranteed": true,
        "cat_code": "fee_waiver",
        "value_amount": 1,
        "value_unit": "fee_fraction"
      },
      {
        "title": "Cashback",
        "value_display": "MUR 5,000",
        "is_guaranteed": false,
        "cat_code": "cashback",
        "value_amount": 5000,
        "value_unit": "amount"
      },
      {
        "title": "Priority service",
        "value_display": null,
        "is_guaranteed": false,
        "cat_code": null
      }
    ],
    "allocations": [],
    "submitted_at": "2026-10-02T10:00:00Z",
    "expires_at": null
  }
}
